{
  "id": "revision-68bb45a2a9a176aa",
  "taskId": "route-the-wiki-store-through-its-owner",
  "ownedPaths": [
    "docs/design/2026-10-06-route-the-wiki-store-through-its-owner.md",
    "src/core/layout.ts",
    "src/core/locks.ts",
    "src/wiki/store.ts",
    "tests/unit/owner-rule-covers-evidence-and-trace.test.ts",
    "tests/unit/record-ownership-answers-every-surface.test.ts",
    "tests/unit/wiki-closure-follows-its-owner.test.ts",
    "tests/unit/wiki-store-durability.test.ts"
  ],
  "manifestHash": "6c72e91cf7a520f75ca092abe8365ccfdfa2fcd3a870a491734fefae7b660f98",
  "pathDigests": {
    "docs/design/2026-10-06-route-the-wiki-store-through-its-owner.md": "8b5c295ccee32b6b320b176cefc7fdf93bf571200098e59428642634f6946680",
    "src/core/layout.ts": "ea9c4dc6b9641edc84c020c78a65a9b572265ab0721c1bbc39687411f8eaea74",
    "src/core/locks.ts": "4449f2a57a2bda682da214548e8628d8acf4c752da675cf2183035fe533cfeba",
    "src/wiki/store.ts": "7ec94d1337253e3d48abe6baf234eb4452fd3a0b59786b297ce9d9ac991ae6c8",
    "tests/unit/owner-rule-covers-evidence-and-trace.test.ts": "4bed2f66a050548d12c847e191916f9a660ef1122d8257e715f69ccc5872cbc0",
    "tests/unit/record-ownership-answers-every-surface.test.ts": "f9eeea0ca2b43ee65e29fa998094b27e3bed37f620aac2f9b8fedae900981e9c",
    "tests/unit/wiki-closure-follows-its-owner.test.ts": "756e0f031f8616965bd93d132e8be9e7b67fd7156ee4797d80f2f46816f78247",
    "tests/unit/wiki-store-durability.test.ts": "1116880fe7c72e5a126c699ebb323900ccbbbf10b65eee083ca7aef69a7e92aa"
  },
  "contentDigests": {
    ".agent/skills/openspec-apply-change/SKILL.md": "83e0d2d4c47674e312fc9d29297d91e5c018a5507e6961829ee623600e2cf2ff",
    ".agent/skills/openspec-archive-change/SKILL.md": "85c8764715a18fbd11d16ca04bd9e15d8644bf5e4203176ad34eee192b546472",
    ".agent/skills/openspec-bulk-archive-change/SKILL.md": "3c6ddb48075af73c9fc09ded392b2ba30be95137b081a0fb3f31ebe805a7526a",
    ".agent/skills/openspec-continue-change/SKILL.md": "329668263b606ae68c575c4d66eafbedffa2a32c7fb4e1a6ed39e9c38b1c1317",
    ".agent/skills/openspec-explore/SKILL.md": "79249f798ad0d69bf95f08f3c7a29d44d982e4c1645f1a12a21dfcd488f4ba0d",
    ".agent/skills/openspec-ff-change/SKILL.md": "462e04573be904d71865dc43d105e0d8b7445ecf875da6af65a1e65101f31d41",
    ".agent/skills/openspec-new-change/SKILL.md": "c993693c31bc6d62ef940de6d58c3f9749f240ecf2bf9decc09b8ee846b5556f",
    ".agent/skills/openspec-onboard/SKILL.md": "477b2e6d6f3ff7e3da69d870840145434df37a42b9c432f2b5f8139bc1f88b38",
    ".agent/skills/openspec-propose/SKILL.md": "a666b2381a7d5e982d8e32183484020f518da2b795c0f387c5ff4b3cb47be0fd",
    ".agent/skills/openspec-sync-specs/SKILL.md": "420e5815eee33ebd642b9d038f0a5307b176923a5c1a837c4873e51de085aae3",
    ".agent/skills/openspec-verify-change/SKILL.md": "8b47bf0dce2e9fe5ee3a8a5ab63d56e13dd4cde9ccf0d076fba0bfd017c285d7",
    ".agent/workflows/opsx-apply.md": "f60f9ae5a14ddd4d580c02b93e654bdc415fa582a536f23aabf034fe2e223b71",
    ".agent/workflows/opsx-archive.md": "5e699d70aafa805773e1bb6bc1eda1ae2b072b500795f5c021cf830e1432c1fd",
    ".agent/workflows/opsx-bulk-archive.md": "59951aa9d2292bae351f7ca26029276c8a495a84d916e7d1d7e53509399f1826",
    ".agent/workflows/opsx-continue.md": "d39c0abf6ff63f62e3abbadfe4abfdb74b425f1369e381a2b42c0351524b2014",
    ".agent/workflows/opsx-explore.md": "3f83f2c4d98477a32b93dc1cd5d80592ef2f7abd6f23cf87421bf86347b7139d",
    ".agent/workflows/opsx-ff.md": "9b02794ab1d5920878f4dfde3fc088438d7505d863a83ce7791ac681b90c145b",
    ".agent/workflows/opsx-new.md": "773421bbc0d4959ad1863225deda18f6084f0c4984220e8fff785c17c2218dc6",
    ".agent/workflows/opsx-onboard.md": "6afb5420ba89c27ee2d28808b26abe7bfbc52f6c1e1f60f3dcba67d8c113e2b8",
    ".agent/workflows/opsx-propose.md": "52322790d84d0faec27a999dce1d17b1aef4a8d5f2e17df3a9387a395137b85a",
    ".agent/workflows/opsx-sync.md": "341ffeb7cd7df5c0af7a4b760d15f6f7d57dbd7ab1ca65b86f4e3f6abe630408",
    ".agent/workflows/opsx-verify.md": "2f4d02a488441f95a8a132c3038c984194392d6d3d1f6fa7e878b14f446d23dd",
    ".agents/skills/brainstorming/scripts/frame-template.html": "6a8a4e58bd6a44b904e2e3c57de774481d909204597e1498de53f1b2fecc4c4e",
    ".agents/skills/brainstorming/scripts/helper.js": "43c6d69954a46ec34a2a262bcc62a9a7e83e839c739f199cb72646d397c686e3",
    ".agents/skills/brainstorming/scripts/server.cjs": "2d2961ea8d11f56c5f4c3a1a68d22709efa5d7601a2246d8c880774e7e9e8412",
    ".agents/skills/brainstorming/scripts/start-server.sh": "a4e5ae84275bcaacd2f84345afeabe59cf7b00ba080e123da7cc1fb226f12847",
    ".agents/skills/brainstorming/scripts/stop-server.sh": "0b5ccbbd57f62d3ed88993f7940b5ee0e5c0fc9b21c550c623da4f6292e47daf",
    ".agents/skills/brainstorming/SKILL.md": "74edf03ea6d24ef53db48677b93558d14a979bdf052ca3f57ecdca0c66791608",
    ".agents/skills/brainstorming/spec-document-reviewer-prompt.md": "95a0a195de9d984be2fffa95bab16fc8c563bc296a9cfc5e9c29cb3ece0d7457",
    ".agents/skills/brainstorming/visual-companion.md": "77eb44a4ec3408bb3dafb872288ecd94beb8cf21da4f2bafa54fd08255d7808b",
    ".agents/skills/comet-any/agents/openai.yaml": "2df3066008cda745920658854360b79c921ff2c966f0fc768b95023f2329546a",
    ".agents/skills/comet-any/reference/authored-zone-example.md": "3993c34ba9fc3864135ea9c22575cc20b01c3c0c074d46cd38bf80fdf50a3f18",
    ".agents/skills/comet-any/reference/authoring-subagents.md": "0b393853501b63548ff5a030789db7367b08575a84d23c9555d1412531b9a42d",
    ".agents/skills/comet-any/reference/bundle-authoring.md": "f1e2b9baf9b9f81934a998b4ac89e8ac43cdf625bea947490efe836ab668263e",
    ".agents/skills/comet-any/reference/eval-provider.md": "257184a6091ebcbd2ebb5ccfd1efe63e8dac3bc6bd4e032351c11e548ac4b372",
    ".agents/skills/comet-any/reference/subagents/pause-points-author.md": "8344469373b8f1197edd8e0696a7c161fd107b92aeb250eafab4da7ad0ec9ee2",
    ".agents/skills/comet-any/reference/subagents/reference-author.md": "449fe8f9a88a339d59155770b60151861804e19c5e02495357aff2e2125e75a6",
    ".agents/skills/comet-any/reference/subagents/script-author.md": "e2eec93985d0432003748b44c6180e737e05669b707380e72ed16ace1a241be5",
    ".agents/skills/comet-any/reference/subagents/skill-core-author.md": "d9336c07c9168d119de04c70b45106608a81dcd4e6447f7364b8f4bf784850a3",
    ".agents/skills/comet-any/reference/subagents/skill-reviewer.md": "5c0a3eb84b4e14dea9583f43a767a7ae1752c5351fb054b8733814a2bab38fed",
    ".agents/skills/comet-any/reference/subagents/workflow-entry-author.md": "38624e662468d604cf155f47a416e03205f7761f9abc32bf592f437351bd6d7d",
    ".agents/skills/comet-any/SKILL.md": "378cded48e7528259a57b50b2dbef8386acea392f1a3f22746b978681a0c9059",
    ".agents/skills/comet-archive/agents/openai.yaml": "5777d820fe0a94c2070c62b54e4beae86cfdd066ffd6a467ff70fa9eb8a9dd68",
    ".agents/skills/comet-archive/SKILL.md": "bc8e1ed7239581ca69a3a75e7598fa8bdd552ece8c0a2c2dd7c8d11869d1dacf",
    ".agents/skills/comet-build/agents/openai.yaml": "783caaa3122b8d9be13ca7b5879da81af621df2bc9cbfff400a752a9108416fd",
    ".agents/skills/comet-build/SKILL.md": "c9375cecc390c9b7a5cb66030ffcca722e13526bbe2fdba9c9ef1f48dbc0177b",
    ".agents/skills/comet-classic/agents/openai.yaml": "2fce0e10d3fbde0fc88edfab9ec42eea789cee941e6dd8d7539d29b4fd574a68",
    ".agents/skills/comet-classic/reference/auto-transition.md": "7b23afcd301a55e5dbecfa6e97f8aa69f8821a6ba15e433260d742d98546273b",
    ".agents/skills/comet-classic/reference/classic-layout.md": "60bd6630283361ae7d0890f01d966925d1c8a1bf3492cb2255f9d8e87200d661",
    ".agents/skills/comet-classic/reference/comet-yaml-fields.md": "f28408d2ea1a226bbfc46b2279a4821cdba6fa330c31d819dedd9b4c447409b2",
    ".agents/skills/comet-classic/reference/context-recovery.md": "d82d410ea590661c42e55373fa6b87ef591981bdd04e32b5160427ef8fa63304",
    ".agents/skills/comet-classic/reference/debug-gate.md": "729d248df4b9b13a7db786f5f606da8b1a514dda7fce779e755a78fe0a333f12",
    ".agents/skills/comet-classic/reference/decision-point.md": "e3eb143bbd5cb42796addd4c03cac291aa7f8bae328d631fc9bc26e9248c423c",
    ".agents/skills/comet-classic/reference/dirty-worktree.md": "b7e9a6b5c6631e3e411358b3d5871ebd21897b356d20a1bd5de344c83d1e9249",
    ".agents/skills/comet-classic/reference/file-structure.md": "fbc57cf63aa7603fcaf6dc7d7c3e10d2d89d506e0954ac4eef6acd828873445d",
    ".agents/skills/comet-classic/reference/intent-frame.md": "3e903c26e705be53b19e008f59121bb5939ff07ddff2ba50b27fb431526edd4a",
    ".agents/skills/comet-classic/reference/scripts.md": "7ed6f39283d77f23352767d8e6c8ba5e150dcbad35f7b33eaef6355f05742fa7",
    ".agents/skills/comet-classic/reference/subagent-dispatch.md": "186d0b125e4c94098086673de1a9506e3f48f0a1cfa6a9d16401c25644723528",
    ".agents/skills/comet-classic/reference/workspace.md": "eb401d6893c8e12a3fd7a94c21bda89a7ffdf7a0626290c57c9a32b8b9dc0556",
    ".agents/skills/comet-classic/SKILL.md": "4a3dae5078546765f0bb23d3487d6a2c0df960edf36068c5d2cc170c486a2700",
    ".agents/skills/comet-design/agents/openai.yaml": "e572c5b7537b902b050741c035cb99543fbb69e0266d53a9483ed964df0b28d8",
    ".agents/skills/comet-design/SKILL.md": "d9ec7b4f0f100d448af71ed643b2c36fa30747059a3da54d5c8157972a7fb6a6",
    ".agents/skills/comet-hotfix/agents/openai.yaml": "26df9711e188b5ee49b42d1844ac6dd2d27eca53951cba549d4408fcc33af8c3",
    ".agents/skills/comet-hotfix/SKILL.md": "f9f0f4bbc582af522f8df297b54f7ac61d5b108ec7ddd25e371d9a2cfa2409c0",
    ".agents/skills/comet-memory/agents/openai.yaml": "c8bc51eb3b66edc5749602b638086ff8a2e96b462d67ced55ef0f42c95472c24",
    ".agents/skills/comet-memory/SKILL.md": "21652660418993c76a8dea031e0872a166c3edb353884ed8d1a623f6acb1c635",
    ".agents/skills/comet-open/agents/openai.yaml": "2ff2e492c5a705195f98b9f350a8ae6a1f204a8fb2e00fe992bdafabbb55af63",
    ".agents/skills/comet-open/SKILL.md": "79153d3de6d8c6c43512cfbd43134a1aac71c101f7a6ca6bbec4caf6e39ca1ee",
    ".agents/skills/comet-review/agents/openai.yaml": "1b008b528fc764ffc4817a8cb9853115b4d5d9ae4bb1c378dbcd59314a37144c",